{
  "id": "550e8400-e29b-41d4-a716-446655440001",
  "name": "Single Guest - YouTube v1",
  "version": 1,
  "status": "PUBLISHED",
  "locked": true,
  "canvas_config": {
    "width": 1280,
    "height": 720,
    "background_color": "#667eea"
  },
  "role_slots": [
    {
      "role": "BG.MAIN",
      "visible_by_default": true,
      "position": {
        "x": 0,
        "y": 0,
        "width": 1280,
        "height": 720
      },
      "z_index": 0,
      "transform": {
        "scale": 1,
        "rotation": 0
      }
    },
    {
      "role": "CHAR.HOST.LALA",
      "visible_by_default": true,
      "position": {
        "x": 100,
        "y": 150,
        "width": 400,
        "height": 550
      },
      "z_index": 10,
      "transform": {
        "scale": 1,
        "rotation": 0
      },
      "filters": {
        "dropShadow": true
      }
    },
    {
      "role": "CHAR.HOST.JUSTAWOMANINHERPRIME",
      "visible_by_default": true,
      "position": {
        "x": 780,
        "y": 150,
        "width": 400,
        "height": 550
      },
      "z_index": 10,
      "transform": {
        "scale": 1,
        "rotation": 0
      },
      "filters": {
        "dropShadow": true
      }
    },
    {
      "role": "CHAR.GUEST.1",
      "visible_by_default": false,
      "conditional_rules": {
        "show_if": "EPISODE.HAS_GUEST"
      },
      "position": {
        "x": 440,
        "y": 120,
        "width": 400,
        "height": 580
      },
      "z_index": 15,
      "transform": {
        "scale": 1.1,
        "rotation": 0
      },
      "filters": {
        "dropShadow": true
      }
    },
    {
      "role": "TEXT.SHOW.TITLE",
      "visible_by_default": true,
      "position": {
        "x": 50,
        "y": 30,
        "width": 600,
        "height": 100
      },
      "z_index": 20,
      "text_style": {
        "font_family": "Montserrat",
        "font_weight": 700,
        "font_size": 56,
        "color": "#ffffff",
        "stroke": {
          "color": "#000000",
          "width": 4
        },
        "shadow": {
          "blur": 6,
          "offset": [3, 3],
          "color": "#000000"
        }
      }
    },
    {
      "role": "BRAND.SHOW.TITLE_GRAPHIC",
      "visible_by_default": false,
      "position": {
        "x": 50,
        "y": 30,
        "width": 400,
        "height": 100
      },
      "z_index": 20
    },
    {
      "role": "UI.ICON.HOLDER.MAIN",
      "visible_by_default": false,
      "conditional_rules": {
        "show_if": "COMPOSITION.ICONS_ENABLED"
      },
      "position": {
        "x": 920,
        "y": 560,
        "width": 340,
        "height": 140
      },
      "z_index": 5
    }
  ],
  "safe_zones": {
    "youtube": {
      "x": 40,
      "y": 40,
      "width": 1200,
      "height": 640
    },
    "instagram": {
      "x": 80,
      "y": 80,
      "width": 1120,
      "height": 560
    }
  },
  "required_roles": [
    "BG.MAIN",
    "CHAR.HOST.LALA",
    "CHAR.HOST.JUSTAWOMANINHERPRIME"
  ],
  "optional_roles": [
    "CHAR.GUEST.1",
    "CHAR.GUEST.2",
    "TEXT.SHOW.TITLE",
    "BRAND.SHOW.TITLE_GRAPHIC",
    "UI.ICON.*",
    "UI.ICON.HOLDER.MAIN"
  ],
  "formats_supported": [
    "YOUTUBE",
    "YOUTUBE_MOBILE"
  ],
  "created_at": "2026-01-26T07:30:00Z",
  "updated_at": "2026-01-26T07:30:00Z"
}
