{
  "id": "550e8400-e29b-41d4-a716-446655440003",
  "name": "Wardrobe Showcase - YouTube v1",
  "version": 1,
  "status": "PUBLISHED",
  "locked": true,
  "canvas_config": {
    "width": 1280,
    "height": 720,
    "background_color": "#ec4899"
  },
  "role_slots": [
    {
      "role": "BG.MAIN",
      "visible_by_default": true,
      "position": {
        "x": 0,
        "y": 0,
        "width": 1280,
        "height": 720
      },
      "z_index": 0
    },
    {
      "role": "CHAR.HOST.LALA",
      "visible_by_default": true,
      "position": {
        "x": 200,
        "y": 100,
        "width": 400,
        "height": 600
      },
      "z_index": 10,
      "filters": {
        "dropShadow": true
      }
    },
    {
      "role": "CHAR.HOST.JUSTAWOMANINHERPRIME",
      "visible_by_default": true,
      "position": {
        "x": 680,
        "y": 100,
        "width": 400,
        "height": 600
      },
      "z_index": 10,
      "filters": {
        "dropShadow": true
      }
    },
    {
      "role": "TEXT.SHOW.TITLE",
      "visible_by_default": true,
      "position": {
        "x": 40,
        "y": 20,
        "width": 700,
        "height": 80
      },
      "z_index": 20,
      "text_style": {
        "font_family": "Oswald",
        "font_weight": 700,
        "font_size": 58,
        "color": "#ffffff",
        "stroke": {
          "color": "#8b5cf6",
          "width": 4
        },
        "shadow": {
          "blur": 6,
          "offset": [3, 3],
          "color": "#000000"
        }
      }
    },
    {
      "role": "WARDROBE.PANEL",
      "visible_by_default": false,
      "conditional_rules": {
        "show_if": "COMPOSITION.WARDROBE_ENABLED"
      },
      "position": {
        "x": 40,
        "y": 500,
        "width": 1200,
        "height": 200
      },
      "z_index": 5,
      "filters": {
        "opacity": 0.9
      }
    },
    {
      "role": "WARDROBE.ITEM.1",
      "visible_by_default": false,
      "conditional_rules": {
        "show_if": "COMPOSITION.WARDROBE_ENABLED"
      },
      "position": {
        "x": 60,
        "y": 520,
        "width": 140,
        "height": 160
      },
      "z_index": 6
    },
    {
      "role": "WARDROBE.ITEM.2",
      "visible_by_default": false,
      "conditional_rules": {
        "show_if": "COMPOSITION.WARDROBE_ENABLED"
      },
      "position": {
        "x": 215,
        "y": 520,
        "width": 140,
        "height": 160
      },
      "z_index": 6
    },
    {
      "role": "WARDROBE.ITEM.3",
      "visible_by_default": false,
      "conditional_rules": {
        "show_if": "COMPOSITION.WARDROBE_ENABLED"
      },
      "position": {
        "x": 370,
        "y": 520,
        "width": 140,
        "height": 160
      },
      "z_index": 6
    },
    {
      "role": "WARDROBE.ITEM.4",
      "visible_by_default": false,
      "conditional_rules": {
        "show_if": "COMPOSITION.WARDROBE_ENABLED"
      },
      "position": {
        "x": 525,
        "y": 520,
        "width": 140,
        "height": 160
      },
      "z_index": 6
    },
    {
      "role": "WARDROBE.ITEM.5",
      "visible_by_default": false,
      "conditional_rules": {
        "show_if": "COMPOSITION.WARDROBE_ENABLED"
      },
      "position": {
        "x": 680,
        "y": 520,
        "width": 140,
        "height": 160
      },
      "z_index": 6
    },
    {
      "role": "WARDROBE.ITEM.6",
      "visible_by_default": false,
      "conditional_rules": {
        "show_if": "COMPOSITION.WARDROBE_ENABLED"
      },
      "position": {
        "x": 835,
        "y": 520,
        "width": 140,
        "height": 160
      },
      "z_index": 6
    },
    {
      "role": "WARDROBE.ITEM.7",
      "visible_by_default": false,
      "conditional_rules": {
        "show_if": "COMPOSITION.WARDROBE_ENABLED"
      },
      "position": {
        "x": 990,
        "y": 520,
        "width": 140,
        "height": 160
      },
      "z_index": 6
    },
    {
      "role": "WARDROBE.ITEM.8",
      "visible_by_default": false,
      "conditional_rules": {
        "show_if": "COMPOSITION.WARDROBE_ENABLED"
      },
      "position": {
        "x": 1080,
        "y": 520,
        "width": 140,
        "height": 160
      },
      "z_index": 6
    }
  ],
  "safe_zones": {
    "youtube": {
      "x": 40,
      "y": 40,
      "width": 1200,
      "height": 640
    }
  },
  "required_roles": [
    "BG.MAIN",
    "CHAR.HOST.LALA",
    "CHAR.HOST.JUSTAWOMANINHERPRIME"
  ],
  "optional_roles": [
    "TEXT.SHOW.TITLE",
    "WARDROBE.PANEL",
    "WARDROBE.ITEM.1",
    "WARDROBE.ITEM.2",
    "WARDROBE.ITEM.3",
    "WARDROBE.ITEM.4",
    "WARDROBE.ITEM.5",
    "WARDROBE.ITEM.6",
    "WARDROBE.ITEM.7",
    "WARDROBE.ITEM.8"
  ],
  "formats_supported": [
    "YOUTUBE"
  ],
  "created_at": "2026-01-26T07:30:00Z",
  "updated_at": "2026-01-26T07:30:00Z"
}
